{
  "schema_version": "1.0",
  "dataset_id": "litecr-algorithm-variants-v1",
  "dataset_status": "synthetic_fixture",
  "purpose": "mechanics_only",
  "provenance": {
    "description": "Hand-constructed scalar edit and one-edit hard-negative controls across seven explicit scripts. No real-person data; labels encode test construction only.",
    "contains_real_person_data": false,
    "generator": "manual-algorithm-variant-fixture-v1",
    "seed": "fixed-hand-authored",
    "created_at": "2026-10-09"
  },
  "splits": [
    "held_out_test"
  ],
  "records": [
    {
      "record_id": "syn-rec-001",
      "source_system": "urn:litecr:synthetic:source:alpha",
      "gold_cluster_id": "syn-person-001",
      "split": "held_out_test",
      "name_assertions": [
        {
          "original_value": "ກຂຄງ",
          "script": "Laoo",
          "language": "lo",
          "representation": "source_original",
          "normalization_version": "fixture-raw-v1"
        }
      ],
      "date_of_birth": null,
      "identifiers": [],
      "contacts": [],
      "address_token": null,
      "case_tags": [
        "variant-anchor"
      ]
    },
    {
      "record_id": "syn-rec-002",
      "source_system": "urn:litecr:synthetic:source:alpha",
      "gold_cluster_id": "syn-person-001",
      "split": "held_out_test",
      "name_assertions": [
        {
          "original_value": "ກຂງງ",
          "script": "Laoo",
          "language": "lo",
          "representation": "source_original",
          "normalization_version": "fixture-raw-v1"
        }
      ],
      "date_of_birth": null,
      "identifiers": [],
      "contacts": [],
      "address_token": null,
      "case_tags": [
        "variant-substitution"
      ]
    },
    {
      "record_id": "syn-rec-003",
      "source_system": "urn:litecr:synthetic:source:alpha",
      "gold_cluster_id": "syn-person-001",
      "split": "held_out_test",
      "name_assertions": [
        {
          "original_value": "ກຂກຄງ",
          "script": "Laoo",
          "language": "lo",
          "representation": "source_original",
          "normalization_version": "fixture-raw-v1"
        }
      ],
      "date_of_birth": null,
      "identifiers": [],
      "contacts": [],
      "address_token": null,
      "case_tags": [
        "variant-insertion"
      ]
    },
    {
      "record_id": "syn-rec-004",
      "source_system": "urn:litecr:synthetic:source:alpha",
      "gold_cluster_id": "syn-person-001",
      "split": "held_out_test",
      "name_assertions": [
        {
          "original_value": "ກຂງ",
          "script": "Laoo",
          "language": "lo",
          "representation": "source_original",
          "normalization_version": "fixture-raw-v1"
        }
      ],
      "date_of_birth": null,
      "identifiers": [],
      "contacts": [],
      "address_token": null,
      "case_tags": [
        "variant-deletion"
      ]
    },
    {
      "record_id": "syn-rec-005",
      "source_system": "urn:litecr:synthetic:source:alpha",
      "gold_cluster_id": "syn-person-001",
      "split": "held_out_test",
      "name_assertions": [
        {
          "original_value": "ກຄຂງ",
          "script": "Laoo",
          "language": "lo",
          "representation": "source_original",
          "normalization_version": "fixture-raw-v1"
        }
      ],
      "date_of_birth": null,
      "identifiers": [],
      "contacts": [],
      "address_token": null,
      "case_tags": [
        "variant-transposition"
      ]
    },
    {
      "record_id": "syn-rec-006",
      "source_system": "urn:litecr:synthetic:source:alpha",
      "gold_cluster_id": "syn-person-002",
      "split": "held_out_test",
      "name_assertions": [
        {
          "original_value": "ຂຂຄງ",
          "script": "Laoo",
          "language": "lo",
          "representation": "source_original",
          "normalization_version": "fixture-raw-v1"
        }
      ],
      "date_of_birth": null,
      "identifiers": [],
      "contacts": [],
      "address_token": null,
      "case_tags": [
        "variant-hard-negative"
      ]
    },
    {
      "record_id": "syn-rec-007",
      "source_system": "urn:litecr:synthetic:source:alpha",
      "gold_cluster_id": "syn-person-003",
      "split": "held_out_test",
      "name_assertions": [
        {
          "original_value": "กขคง",
          "script": "Thai",
          "language": "th",
          "representation": "source_original",
          "normalization_version": "fixture-raw-v1"
        }
      ],
      "date_of_birth": null,
      "identifiers": [],
      "contacts": [],
      "address_token": null,
      "case_tags": [
        "variant-anchor"
      ]
    },
    {
      "record_id": "syn-rec-008",
      "source_system": "urn:litecr:synthetic:source:alpha",
      "gold_cluster_id": "syn-person-003",
      "split": "held_out_test",
      "name_assertions": [
        {
          "original_value": "กขงง",
          "script": "Thai",
          "language": "th",
          "representation": "source_original",
          "normalization_version": "fixture-raw-v1"
        }
      ],
      "date_of_birth": null,
      "identifiers": [],
      "contacts": [],
      "address_token": null,
      "case_tags": [
        "variant-substitution"
      ]
    },
    {
      "record_id": "syn-rec-009",
      "source_system": "urn:litecr:synthetic:source:alpha",
      "gold_cluster_id": "syn-person-003",
      "split": "held_out_test",
      "name_assertions": [
        {
          "original_value": "กขกคง",
          "script": "Thai",
          "language": "th",
          "representation": "source_original",
          "normalization_version": "fixture-raw-v1"
        }
      ],
      "date_of_birth": null,
      "identifiers": [],
      "contacts": [],
      "address_token": null,
      "case_tags": [
        "variant-insertion"
      ]
    },
    {
      "record_id": "syn-rec-010",
      "source_system": "urn:litecr:synthetic:source:alpha",
      "gold_cluster_id": "syn-person-003",
      "split": "held_out_test",
      "name_assertions": [
        {
          "original_value": "กขง",
          "script": "Thai",
          "language": "th",
          "representation": "source_original",
          "normalization_version": "fixture-raw-v1"
        }
      ],
      "date_of_birth": null,
      "identifiers": [],
      "contacts": [],
      "address_token": null,
      "case_tags": [
        "variant-deletion"
      ]
    },
    {
      "record_id": "syn-rec-011",
      "source_system": "urn:litecr:synthetic:source:alpha",
      "gold_cluster_id": "syn-person-003",
      "split": "held_out_test",
      "name_assertions": [
        {
          "original_value": "กคขง",
          "script": "Thai",
          "language": "th",
          "representation": "source_original",
          "normalization_version": "fixture-raw-v1"
        }
      ],
      "date_of_birth": null,
      "identifiers": [],
      "contacts": [],
      "address_token": null,
      "case_tags": [
        "variant-transposition"
      ]
    },
    {
      "record_id": "syn-rec-012",
      "source_system": "urn:litecr:synthetic:source:alpha",
      "gold_cluster_id": "syn-person-004",
      "split": "held_out_test",
      "name_assertions": [
        {
          "original_value": "ขขคง",
          "script": "Thai",
          "language": "th",
          "representation": "source_original",
          "normalization_version": "fixture-raw-v1"
        }
      ],
      "date_of_birth": null,
      "identifiers": [],
      "contacts": [],
      "address_token": null,
      "case_tags": [
        "variant-hard-negative"
      ]
    },
    {
      "record_id": "syn-rec-013",
      "source_system": "urn:litecr:synthetic:source:alpha",
      "gold_cluster_id": "syn-person-005",
      "split": "held_out_test",
      "name_assertions": [
        {
          "original_value": "កខគឃ",
          "script": "Khmr",
          "language": "km",
          "representation": "source_original",
          "normalization_version": "fixture-raw-v1"
        }
      ],
      "date_of_birth": null,
      "identifiers": [],
      "contacts": [],
      "address_token": null,
      "case_tags": [
        "variant-anchor"
      ]
    },
    {
      "record_id": "syn-rec-014",
      "source_system": "urn:litecr:synthetic:source:alpha",
      "gold_cluster_id": "syn-person-005",
      "split": "held_out_test",
      "name_assertions": [
        {
          "original_value": "កខឃឃ",
          "script": "Khmr",
          "language": "km",
          "representation": "source_original",
          "normalization_version": "fixture-raw-v1"
        }
      ],
      "date_of_birth": null,
      "identifiers": [],
      "contacts": [],
      "address_token": null,
      "case_tags": [
        "variant-substitution"
      ]
    },
    {
      "record_id": "syn-rec-015",
      "source_system": "urn:litecr:synthetic:source:alpha",
      "gold_cluster_id": "syn-person-005",
      "split": "held_out_test",
      "name_assertions": [
        {
          "original_value": "កខកគឃ",
          "script": "Khmr",
          "language": "km",
          "representation": "source_original",
          "normalization_version": "fixture-raw-v1"
        }
      ],
      "date_of_birth": null,
      "identifiers": [],
      "contacts": [],
      "address_token": null,
      "case_tags": [
        "variant-insertion"
      ]
    },
    {
      "record_id": "syn-rec-016",
      "source_system": "urn:litecr:synthetic:source:alpha",
      "gold_cluster_id": "syn-person-005",
      "split": "held_out_test",
      "name_assertions": [
        {
          "original_value": "កខឃ",
          "script": "Khmr",
          "language": "km",
          "representation": "source_original",
          "normalization_version": "fixture-raw-v1"
        }
      ],
      "date_of_birth": null,
      "identifiers": [],
      "contacts": [],
      "address_token": null,
      "case_tags": [